reviews,rating
"Great place to have a cup of coffee. If you are on the keto diet, McDonald's has whipped butter. Yes it's real butter. Along with half and half. You could ask for whipped cream. Believe me there coffee tastes much better with butter  and cream in it .  They do not have Stevia . They can make you a keto breakfast. Which is eggs bacon and sausage layered.",4 stars
"Understaffed,   slow as a result.    Those that are working,  are courteous and apologetic..  what I don't understand is considering the location,  (Disney area)  that this McDonald's isn't better staffed.",3 stars
They're not bad. So far I've never had them get an order wrong,5 stars
For pure volume pretty darn efficient. Clean too all things considered.Use auto order screens. Faster. Didn't try drive thru,4 stars
Sat in drive thru for 30 minutes. Food was cold. Manager extremely rude. Go elsewhere. This location is horrible.,1 star
Very clean.  Attentive staff.  As always reliable and delicious food.,4 stars
"My cousin assumed that we wanted 2 apple slices and 1 go-gurt, but we quickly changed to 1apple slice and 2 go-gurts, but they gave us what we first ordered. The food was rrreeeaaalllyyy ggoodd though! Mmm mmm mmm.",4 stars
"I ordered a caramel frappe with no whip cream. Upon getting my Carmel frappe there was whip cream. They were upset when I requested they fix my order to meet the way I ordered. When they handed it back to my husband, they had scooped out the whip cream and another quarter of the frappe. Very rude about it as well.",1 star
EVERY TIME THEY FORGET SOMETHING. And i mean everytime. I have heard conversations about general nonsense take priority over customers while waiting. The employees generally juat dont seem to care with the exception of a few,2 stars
Stopped on my way to work at 6:15 in the morning drive thru full only about 5 people in the inside line . Waited bout 8 minutes no one took my order . Slow service and everyone speaking Spanish.  Walked out no food,1 star
Disappointed - claimed Egg Mc muffin deal was over and charged outlandish price! Service not great - wrong coffee received after ordering DECAF and NO cream given...,1 star
It's always helpful when the staff is so cheerful and nice and they have great customer service!,5 stars
Food was good but it took 35-40 mins to get it through drive thru,3 stars
"It was terrible, took forever. Only giving 2 stars because the McMuffin was good.",2 stars
I've never been to such a horrible restaurant like this. It took over 1 hour to get fries and a McFlurry. Stay as far away as you can from this McDonald's. Nasty dirty facility too.,1 star
"Very nice McDonald's, it was clean and the employees are very polite and friendly. The play area for the kids is different than others I have seen & the menu was electronic, which was a little annoying being that I was in a bit of a rush.",5 stars
I didn't get much sugar for my coffee all milk and day getting served my Burger not my Burger my sausage mcmuffin didn't give it to me in the morning They got me for some money not a pleasant place to go when you hungry you want your food,2 stars
Horrifically slow even when nobody is in line. The worst Mcdonalds I've been to speed wise. We gave it three tries and it was slow each time.,1 star
Every time I go there it always a long line when you drive pass the window you see employees standing around talking and laughing. They need move a little faster.,5 stars
Never once have I gotten my coffee done right. Cream in sugar out. I got 35 cream in my bag. It was 8 cream in. I got no sugar. Crazy,2 stars
Took 10 minutes to take my cash for order.then another 20 minutes to get my food.which was missing the drink for the happy meal. Not good,1 star
"Terrible service, I think hands down worst mcdonalds I have ever been too. Manager wouldn't even come over to help. Absolute joke of a mcdonalds. Go 1 mile down either way and you will be much happier.",1 star
"Not to thrilled with this one anymore,  used to love it when it was the world biggest McDonalds. Now it's like the others except for a few items on the menu.  Plus they got rid of the life size Ronald McDonald.",2 stars
This is a newer McDonald's with a very modern decor. Service was fast and friendly and the food was about what you would expect for a fast food restaurant. Overall positive experience.,4 stars
Because we had a big order they kept giving our food to other people who had smaller orders. People who ordered after us had already eaten and left by the time we got our food.,1 star
"I waited in the drive thru line for half an hour, ordered my food, and not until I got to the window did they tell me they were taking cash only, at 11pm on a saturday? And when I asked to talk to the manager on duty they were no where to be found, mever returning to this location and would urge anyone thinking of it to stear clear from this horrible McDonalds",1 star
Staff friendly and helpful,5 stars
"Nice, clean and large McDonald's at WDW. Not a bad place to stop for a quick bite to eat going from or to the Animal Kingdom in between parks.",4 stars
Burger was greasy and the fries tasted like the oil needed changed,2 stars
Super slow...we waited an extremely long time in the drive through.  People behind us were beeping and honking because no one was taking orders in one drive thru lane.,1 star
"Diet Coke dispenser spilled water, something was loose in the housing.",4 stars
Itï¿½ï¿½ï¿½,5 stars
This place sucks beyond belief. Staying in a hotel next door have a semi for my wheels. Knocked on the door ask the manager if I could order a shake and get it at the door. I'm sure you can guess the answer,1 star
"AWESOME!!!FAST!!!
AND FANTASTIC FOOD!!!",5 stars
The worst place do even be doing uber the manager makes uber drivers wait and dont even put order thru tell u get there please speed up for me to keep doing uber here and i hope the gm sees this maybe she will make u speed up judith,1 star
"The best McDonald's branch I have ever seen. Clean, big, and kid friendly. Electronic machines to order from are available.",5 stars
"Super long drive thru lines , I suggest u go in the lobby n place order electronically for faster service ï¿½ï¿½ï¿",1 star
Fast drive through. The children enjoyed their lunch!,5 stars
Waited in drive thru for 20 minutes had to go in to get our order.manager was great but they had everyones order messed up.,1 star
"Everything seemed a little ""dry"", and our fries were only lukewarm.",4 stars
"Food it's okay, however the customer service is terrible. The few times I visited here the staff was rude, and unprofessional.",2 stars
Worst prices hair in food stay away no self serve drink station,1 star
Staff is currently learning their job. While waiting for my food the had to correct orders for  4 people.,3 stars
Long wait for food Sunday at 12:40 pm.  We ordered from the kiosk.  We waited longer than people in line.  Food was good.,3 stars
Great burgers and fries!!!,5 stars
"By far the worst McDonald's that I have ever been to. The entire experience was bad, time consuming, and they didn't even get my food right.",1 star
If I could give a zero star I would. This place took 5 minutes to even greet me at the window. I ended up driving away with no food. Don't waste your time here.,1 star
"The wait is 30 minutes, my nuggets where white in the center because they didn't separated them before putting in the fryer, all McDonalds that I visited near my hotel on kisseme took 30 minutes.",1 star
"Good food but ,staff so bad, every one  even the manager",1 star
kiosks ordering in full effect.  take a number and sit down to wait.,3 stars
One of the worst McDonald's in the nation. The food is usually stale or cold and is always made sloppily. When you complain they act like you are at fault for the bad sandwich.,1 star
No free refills. What a drag.,1 star
Too long waiting lines to get a very bad customer service. Food is ok.,2 stars
"Having kiosks, instead of human cashier, really a bad idea not fan of it. Taking my business to a different place were greetings,  and thank you is the most important thing!!",2 stars
Like all the other McDonald's they're expensive underpaid understaffed and they close too early but that's because they're understaffed,1 star
"Very clean, great party structure for the kids, and they have a ""home made"" iced tea, unsweetened!! Awesome!!!! Thanks",5 stars
Very rude customer service. Go somewhere else,1 star
"HORRIBLE I WENT HERE FOR AN UBER PICK UP AND IF YOU DROVE UBER BEFORE YOU CAN PICKUP THRU THE DRIVE THRU AND WHEN I TOLD THEM THAT SHE SAID ""WE ARE REALLY BUSY RIGHT NOW SO YOU HAVE TO COME IN OR ITS UP TO YOU"" WHEN I WENT IN I WAS EXPECTING A LING LINE. BUT INSTEAD THERE WAS ONLY 1 PERSON INFRONT OF ME. NOT BUSY AT ALL. THIS WAS HORRIBLE EXPERIENCE. MCDONALD'S NEVER LETS ME DOWN SMH.",1 star
Over 1 hour to go through the drive thru.  Only 20 cars.  Absolutely a mess.,1 star
Place was good. Sandwich and dessert were nice and warm but I did have a wait quite a bit.,4 stars
They had someone who dont know how to take order and and everything was dry nasty and the coffee plus the manager was there smh,1 star
Waited almost 20 minutes for an order. There were only 5 cars in drive thru and about 7 people inside.  Finally I canceled and went to a sit down restaurant where I got served within 10 minutes.,1 star
False advertising. Drive through is open 24 hours. Diner closes at 10!,1 star
"It's a messy please, the costumer service is very nasty they don't even pay attention to the time that people are waiting in line. I'm not going to gave them any Stars.",1 star
"They missing a few orders of fries and 4 buckets of 20 nuggets but i understand because  they was busy in christmas, good guys and good service",4 stars
Great service by a young lady in the morning didn't get her name but she gave attention to her customers and changed depending who the customer was great well done,4 stars
Food was very good but quite a lot was missing from the order when we got home.,2 stars
Great customer service a little slow. Food cooked right and order was perfectly taken.,5 stars
"Incredible slow, lines are out of control, understaffed.",1 star
Only visited once and drivethrough so don't know anything  about the place. But they where friendly,3 stars
Horrible...order was all messed up. I asked for my food to be freshly cooked...&;I got cold fries,3 stars
Fresh breakfast at 11AM,5 stars
Super fast service and they did not forget anything!!!!,5 stars
Total order mess up and the person taking my order hated his job. The only reason I know is because he told me.,1 star
"This McDonald's is really hit or miss. I've had good experiences, I've had horrifically terrible experience. But I don't expect much because the people are underpaid.",3 stars
Food is always wrong,2 stars
Good for some fast food this one is well taken care of clean bathrooms great customer service,4 stars
It's McDonald's so not much to say except this location is always clean and efficient. Great double drive-thru!,5 stars
This MacDonald's has not once given me the correct amount of nuggets. Lately it's been too many but there are several times where they short me. They've gotten my order completely wrong before too. They just seem to struggle a fair amount.,3 stars
"Food was good, but be prepared for a long wait for your food. It took 22 minutes from order to food receipt lunchtime on a Saturday.",3 stars
Sometimes we have to wait for the food for so long... long lines cars at the drive thru.,3 stars
Worse McDonald's I've ever been to. Twice I've been there and both times I had to sit there and wait almost 15 mins to get my food. The second time the staff was there in the kitchen taking pictures while my food was getting cold. Never again,1 star
It is clean and the orders came out fairly quickly even with the lunch rush. Overall a pleasant experience.,4 stars
"This is a good McDonald's to go to, they got the order perfect and had great customer service!.!",5 stars
This McDonald's is my go to for the kids. They have a very nice and clean play area. Staff is always friendly and helpful.,5 stars
Pay your morning manager more!!! She is a Rockstar keeping that place moving.,4 stars
"Manager came to the table, made sure everything was well. Quick service. Place does get busy",5 stars
Pretty good but my filet-o-fish was all crooked.,4 stars
We waited in the drive thru for 30 minutes. It was late after visiting the parks all day and they were close to our hotel. I would stay clear of this disaster of a restaurant.,1 star
Slowest McDonald's I've ever visited.  Checked in on a pickup order for Uber.  Waited 15 minutes and they were so backed up that they hadn't even started on the order yet.  Will not be returning to this location.,1 star
the service was horrible I was very very disappointed they don't give you the right food that don't take that order correctly then-manager I don't know why they do on their time because you ask for manager and takes forever to come and assist you I will never go there again,1 star
Building is completely locked so can't use bathroom even after waiting for curbside.,1 star
Cash only drive through after waiting 30 minutes,1 star
"They can not get any order right. My order took 3 remakes and finally I had to go in to the restaurant, after placing my original order in the drive thru!",2 stars
"The best mcdonalds. It has it all. Play area, arcade, had a fun time.",5 stars
A drive through line around the building and into the shopping center parking lot that barely moved for 20 minutes made me drive off without ordering.,1 star
"Employees are friendly, place is clean but lock in the mens room is broken. The food is pretty good.",4 stars
Excellent! Kiosk order own food using CC or Debit. Fast service. Good breakfast,5 stars
I dont understand because mc Donald is a fast food place and I go thru the drive thru and  the tell me that I have to wait in one of the parking spots in stead of grab and like any normal fast food.,2 stars
The buttermilk crispy tenders are not crispy nor tender the meat is horrible the worst I've ever had why would I eat here when I can get some decent fries chicken and burgers at Culver's or some f the best fast food chicken from chik full ï¿½ï¿½ï¿,1 star
"Employees were friendly and efficient. We received our food quickly, as well.",5 stars
"They worked hard even as they were shortstaffed, would definitely go back again.",5 stars
"Not sure of manager name we called her peaches, she was wonderful.",5 stars
This is a very cool place litteraly grew up on McDonald's anyone who tells you there food is bad is wrong it may be a little unhealthy for you but it's open 24/7 and has great costumer service I enjoyed this place a lot and so should you,5 stars
Hands down the slowest service I have EVER seen at ANY fast food restaurant.,1 star
Everything was fine,5 stars
Drive threw took forever we waited 40 minutes to find out there ice cream machine was down drive threw cashier was very rude and uncaring,1 star
Slow service got orders wrong but still kept people waiting while rest of their food went cold worst mc donalds I've been to for service,2 stars
Do you feel as bored as my friend is well this McDonald's will not get you bored they will serve you good food hot honest and right and are great twenty-four hours a day,5 stars
"If you need food late at night after work (2-3 am), don't count on this place because they take at MINIMUM 20-30 mins to send you through the drive thru.",1 star
"Fantastic food for a fast food chain, Staff very friendly, My Son gives 5 out 5 stars for food as in England he is always sick afterwards with the oil.",5 stars
"Long lines at this Kissimmee location right by Old Town, but fast moving and good service. Placed a big detailed order and everything came out correct.",5 stars
If the app says you can dine in there than you should be able to dine inside,1 star
"Usally the location I visit is on the money both with over allservice and cleanses, how ever this particular day the place was a total mess and service was horrible when it should not have been because it wasn't busy.",2 stars
"Worse c/s ever! Unreal, people just DON'T want to work. This team bust gave up!",1 star
Great service. Super fast,5 stars
"Clean, great deals, many ways to order...online,drive thru, curbside pick up",4 stars
It was excellent and this is the only place that has not messed up my order,5 stars
It was not too busy this time of year I did visit after 8 p.m. bathrooms were clean can't complain.,5 stars
The fanciest and cleanest McDonald's I've ever been in.Professional and clean.If ours back home was like this one in Kissimmee I'd go there more,4 stars
Food  was hot and delicious service fast. One bad apple  stop me from    Giving this location four or better..,3 stars
Ordered 2 double fish fillet sandwiches and got 1 double and 1 single. Order must be checked and double checked for Togo. I'm not coming back to change the order after few miles.,2 stars
I love McDonald's I told my friends and family about McDonald's and they eat it everyday if addicted food I wish you can did olive oil to fry french fry.,5 stars
They forgot  my drinks and didn't get to have time to stop one the way back to get them,4 stars
They were actually nice and had what we wanted and gave us condiments!,5 stars
Almost always available in the AM for breakfast without the cash only excuse.,5 stars
"Service sucks, how are you 24/7 and randomly close 2-6?? Waste of time",1 star
Great quality food for the price and staff are extremely friendly. Service is also very fast,5 stars
Waited in drive thru line about 10 minutes. Food was fresh and the server kept apologizing  for the wait.,3 stars
They messed up the order after explaining a few times of what we wanted and had hair in both of my egg McMuffins,2 stars
"Horrible bad service waited too long at the  drive through, missing everything in my order",1 star
Our order was large And they were able to complete it in a fast manner,5 stars
"The good thing is that is open 24. They do not have enough personnel. Food was just okay, help us survive till the next morning.",2 stars
Fast and easy great for quick breakfast to start of your day,5 stars
They all work super hard and we're very respectful,5 stars
"Order was correct,food was hot and fresh. Friendly staff.",5 stars
It's McDonald's what can you say? I happen to have had a great experience not only with service but my food being right and fast!,5 stars
Fast and good service,5 stars
Mac fan !,5 stars
Standard food. Fast service. Cash only at night. More expensive than other McDs.,2 stars
Manager doesn't know how to put his name tag on right side up. How can he run a restaurant?,1 star
"Tried 3 of the kiosk to order my food. Never completed an order on a kiosk, something different wasn't available on each one. Busy as hell, took a long time to get my food. Never again",1 star
"Food good as always (Its Mcdonald)
But pretty slow, *fast* food but without the *fast*",3 stars
Nice little spot! Tiny parking lot and its a busy McDonald's for sure. Has the upgraded double car drive thru!,5 stars
Increible how the drivethru work here waiting the outside line more than 5 mins and see how the inside lo e pass 7 cars already... unacceptable,1 star
Place was very clean. Beverage excellent but took 15 minutes for us to get our drinks,3 stars
My son got a vanilla shake there it didn't look right it was soupy he tasted it and his stomach was upset all that day,1 star
Bad experience taking too long with the orders.,1 star
Took 29 minutes in the drive thru for 2 McDoubles and a happy meal. At 7pm.,1 star
Fills a hole if u hungry,3 stars
Lot's of panhandling around the drive through. Food was good and service was quick.,4 stars
They didn't get my very large order wrong that I made for a car full of kids so that says alot.,4 stars
Clean professional staff the location on a busy hwy. but the good out weighed the bad.,5 stars
"Lines were a little long, yet food was fresh and hot.ï¿½ï¿½ï¿",5 stars
"It was a crappy McDonald's. They lie about their hours I went around 9:30 for food and they were ""closed""! When they clearly say that they are 24hours. Don't waste your time with this place! Worst McDonald's ever",1 star
Tortillas stale and why ask if I want sauce if you aren't going to give any? Lol,1 star
Great soft play for little kids.,4 stars
Gave order in the drive thru lady wasn't paying attention on what I wanted mind you I only ordered 3 things had to repeat myself 3 more times at the window then they still get my order wrong never again,1 star
If I could give it zero stars I would we went here 3 times recently and they mess up every time and they are just rude people I would recommend staying away from this location there's a checkers across the street I would recommend over them,1 star
"Drive through is almost always packed, when it's not the computer is down and you have to go inside... which is also always busy.",3 stars
Terrible service. Left the drive thru after barely moving for 10 minutes. Not prepared for late night customers.,1 star
Slow service. And we were the only ones in there  Found hair in my food. If I could give no stars I would never comming back,1 star
Could have been faster ordering. They have 2 lane drive in.,3 stars
The BEST customer service McDonald's.,5 stars
Terrible..An Employee name Andrea has the worse Customer service ever. My order was wrong and they still was giving me a hard time to fix it..BAD SERVICE,1 star
"Me and my family were there at 10:15 pm on a Sunday and they would not let us in.we were not happy at all,wat to soon to be locking doors.",1 star
Computerized orders... take quite a time to be served. I just bought as coffee and waited almost 15 mins for it to be served... and it was a bit cold as well...,3 stars
The only thing worse than the service was the food. My wife's Big Mac tasted like it had been dropped in an ashtray.,2 stars
"Very dirty.  Cold food.  Somebody peed in the play area.  Management was informed, but nobody cleaned it up.",1 star
Its McDonald's.. at least this one the food was fresh and well prepared on our visit,4 stars
ýýýýýý,5 stars
This is my third time visiting this store horrible place to eat all the 3 person at the service desk did not even eye contact with me and after food ready they just damp my order on the desk and I had to asked one gentleman if that was my order then he said  yes horrible place will not recommend it,2 stars
"Nice,  new looking place,  fast service. Can order by counter or on touch screen menu. Then pay at counter or credit card.",5 stars
"Not gonna lie, it's just a McDonalds's but if you have a bad experience, don't think about this five star review when it happens.",5 stars
"Ordered a regular big mac with large fries. They gave me the Bigmac Bacon, it was cold. Fries were cold.",1 star
Spicy chicken was kind of bland and the fries were like warm,3 stars
"The bread is cold meat are dry bad taste .
Ruin Mc Donaldï¿½ï¿½ï¿½ï¿½ï",1 star
My order was to English muffins sausage and eggs my English muffin was really hard around the edge and I had a sausage biscuit with egg my bread was really hard to I've had to throw my bread hey way that will just my money got throwed away.,3 stars
Delicious!,5 stars
"Breakfast was good as usual - quick, clean, and courteous. Manager came by and grabbed my tray to top it off.",4 stars
Loved it,5 stars
"Considering the amount of folks at the time of our visit, the service was great. Salads were delicious.",4 stars
John was great and super friendly everyone els rude,3 stars
"Curbside is a joke
Waited for 15 mins, should just go through the drive thru.",2 stars
Really good. Fast service. Food really hot,5 stars
It was great the food made me all full and I had a fun time,5 stars
Can honestly say that this was the best by far McDonald's meal I have had.,5 stars
Always a long wait today it took 35 min in drive through most times around 15 min but like their ice tea so but up with it,2 stars
Slow as molasses and still couldnt get it right. Dont go here after 12am. Had to go inside and get my $1 soda they forgot to give me.,1 star
Used the drive through.  All was good.,5 stars
It was ok I ordered through drive thru. I had to repeat my order a couple of times.,3 stars
Slowest service of any McDonalds ever. Even ordering just a coffee would take 15 minutes. VERY dirty perimeter outside.,3 stars
"Waited more than 20 mins, trying to make order but they just keep saying"" be right with you"" to finally tell me they dont have what i wanted.",1 star
Watched a Manager Jennifer push and put her hands on an employee while she was handing my food out the window. Don't know why because the Order was 100% right. This is the way employees at McDonald's are treated?,1 star
Same quality incredible quick service at this location I love it,5 stars
Only gave me part of the food that I ordered them the manager gave me attitude they weren't remorseful for messing up my order at all,2 stars
Nothing about fast food. Two lines for drive thru but slow services.,3 stars
FOOD  WAS MEDIOCRE! The service slow and unfriendly.,2 stars
The Drive Thru Was way too long there were 100 cars we we waiting 20 minutes to order. It's shorter ordering inside,1 star
The people at the window customer service skills need to do better.,5 stars
Had a long wait in drive thru but customer service was okay,4 stars
Stopped in for a liquid refreshment today due to the extremely hot weather. It was really delicious.,5 stars
I didn't eat here.  O was with others who did.   They seemed to enjoy it very much.,5 stars
