reviews,rating
Was able to get in and out without delay.  Cashier was friendly.,5 stars
Great for a burger that taste the same around the world,4 stars
Food was good but you never get the sauces you order on the touch screens,4 stars
Management just stands there while employees run around working,1 star
Nice staff. We went thru the drive thru,5 stars
Needed a quick breakfast and this was close.,3 stars
"Extremely slow service, one cashier with multiple people working slowly in the back, a line up to and out the door, and the drive through wrapped around the building. Avoid late at night.",1 star
"It was awesome you got the food quickly, nice service and great atmosphere.",5 stars
"All self service order
Table delivery though ï¿½ï¿½ï¿",4 stars
The diner was dirty and so was all the tables and I dont want to mention the restrooms were smelly and dirty there was two teenagers on their cell phones wasting valuable Time,1 star
waited in drive through for 25 minutes and left after that point went to go somewhere else,4 stars
The lady at the drive-thru was extremely rood and they messed up my big Mac I was missing two cheeseburgers and my 10-piece nugget only had seven nuggets,1 star
"Dirty, unkind, too long waiting time, too high work load with minimum of employees",2 stars
"Neg stars.

After waiting 30 minutes in drive threw, my hashbrown was literitly cold. And my bagel was soggy... worst breakfast ever ï¿½ï¿½ï¿",1 star
It was ok,5 stars
Don't get the breakfast burritos they advertise a nice beautiful looking burrito on their menu and then when you get it it's a quarter of the size of which they advertise the price has gone up on these and the quality has gone way down they have false advertising on their menu,1 star
Worst McDonalds  I've ever been to. Waited over twenty minutes.  Burgers were almost  raw. Plus no toys in happy meals.,1 star
This is my second visit and it's even slower and longer than my first. Unbelievably long wait times in the drive through.,1 star
Very busy but got our large order right...happy people,4 stars
My first bad experience on at McDonald's restaurant the people there were just rude luckily there was one person there that tried to take care of her customers but overall I don't recommend this place,3 stars
Went there all the time and champ !! Recommended go there people very friendly also employees too,5 stars
Long wait and 3manger on duty and one person line. Then to fine out no fish at certain time bk at all times,1 star
Not very well lit drive-thru but the customer service was great,4 stars
More expensive than uk maccies,3 stars
Very nice location. The staff was top notch. They got everything right!,5 stars
Fast service and coffee and sandwiches nice and fresh and employees treat you as a customer,5 stars
Waited on line for 45 mins just to place the order.,2 stars
"Fast, clean and excellent customer service!",5 stars
This McDonald's is horrible customer service and all the employees have bad attitudes and they never make my orders right I always have to continue coming back all the managers are rude to besides the Chinese looking one,1 star
Service is nice and fast but sometimes the drive-thru line can be a mess.,4 stars
Everything was great!,5 stars
it prompted me to legitimately kill myself. so ridiculous. never have had towards long in my 35 years of life,1 star
Love it,5 stars
"Opens late at night, save your day if you come home late. Big parking lot and good service and food.",4 stars
Do not LIKE having to use a koish to order,3 stars
McDonald's is well known anywhere you go... Good service good food..,5 stars
Must say this location is very clean and food is always great!,5 stars
The drive thru went pretty quickly for such a crazy location,4 stars
My favorite places to eat I love it,5 stars
"Service is a bit slow, but it's... well it's just McDonald's.  Playground is nice for the kids though.",5 stars
Only one inaccurate cashier working on a weekday at breakfast. Had to go through line and the waits twice to get my order right. Will not be back to this site.,3 stars
"Hot food, order completed accurately. Better than most McDonald's",5 stars
New but WAY TO BUSY..NO INSTUCTIONS ON HOW TO USE NEW COMPUTER MENUS. WE WAITED 20 MIN FOR OUR DONE IN GOOD.,3 stars
The people working here are not friendly.  Went through the drive through and the only only thing said to me was my total.,2 stars
They got free WiFi. It's really fast and good food and customer service too,5 stars
Somehow they forgot to give us our order...no big deal I needed the exercise and they did apologize,2 stars
"Food was cold.
Service could of been better",2 stars
To the girl that said she liked my tat. Wassup?? You could make this a 5...,4 stars
Slowest service ever! I haven't taste the food but i hope is not bad!,1 star
Waited 30 minutes in drive thru line be told they are out of fish and chicken,2 stars
"I was there to separate times one time I paid over $2 more than the second
time and got the exact same thing",2 stars
Most often just the same mc donalds,4 stars
This one is aware of food allergies so this it makes it easier for us,3 stars
Messed up our order something terrible and then asked us to pay extra for the mess they made took forever in line slow slow people,1 star
Very polite people and fast with getting food out.,5 stars
McDonald's is the worst the foods always cold and they recook old food when you ask for it hot but the frappes are the bomb that's why they got a star.,1 star
Slow and the people behind me got their food first. Common problem here. I just order a drink and burger.,1 star
"Waited 60 minutes in a drive thru, the line wasnt even that big. The lines at the theme parks are better",1 star
Several ordering kiosks here. Service was quick.  Restrooms were clean.,5 stars
$5 for 2 BigMacs need I say more plus $1 each including Refills for any Size Hot/Cold Drinks,5 stars
"Good food, and rewards are nice!!",3 stars
"1 star because I had cheese on my burger last night. And I didn't ask for it. Also the service was slow. The worker's was playing , goofing off ,and not working when suppose to.",1 star
Good food at great prices. Fast and friendly service!,4 stars
Can form a pretty long line at the Drive-Thru as it's a popular location but always polite.,4 stars
Rude managers profiled me. Had my life threaten by Corp. Worst fast food ever,1 star
Poor costumer service.  Slow and cold food.  The manager didn't care about my order had me waiting for over 30 minutes,1 star
"All McDonalds are pretty much the same. Nothing is great, but good if you need to eat on the go.",3 stars
Well let's see it took me 27 minutes to go through their bullship drive-through for 2 mcdoubles holy shedding this a joke,1 star
Slow service,1 star
It's OK as McDonald's goes... Crazy busy after the theme parks close each night. Expect long waits.,3 stars
"Nice friendly staff, the place was clean and the other came quick.",5 stars
I received a excellent service,5 stars
"Clean place, the kids meals fries are the cutest..lol fast service",5 stars
Excellent coffee!....that's all I got...with a double shot of espresso... happiness in a paper cup!,4 stars
Ice cream machine never works after waiting 20 minutes in drive thru line for nothing,1 star
"Drive thru takes forever and orders are never right, the inside with the new send order plus counter orders it's mobbed and confusing",2 stars
Horrible customer service. Avoid this restaurant if at all possible.,1 star
This mcdonalds serves lettuce that had already gone bad and turned brown. Absolutely disgusting.,1 star
As good as ever,5 stars
"This place is Nasty as heck ! The Garbage was over flowing, there was bugs on the floor, and all the bathroom stalls was locked even though there was no one in them",1 star
"Super slow service,  sloppy wrapped cheese burgers, not so friendly staff, some of them not all staff. what more can i say.",1 star
"No customer service skills, not even the managers always getting orders  wrong and give u attitude bc u said something",1 star
"Might be I expect more from it. But, in comparison to the EU McDonald's the food is poor. Drive through is a nightmare.",2 stars
Can't ever get order right. Had to walk into the back to find someone to wait on me.,1 star
They didn't have apple slices and toy for the Happy meal.,1 star
Ordered breakfast. Was ok. Pancakes on both orders were cold and dry.,3 stars
"Speed, very good service, attentive and efficient employees",5 stars
"Might be the worst McDonald's I've seen can't even make a coffee no napkins, ketchup or even a fork with my big breakfast meal worst idea to stop there",1 star
"Fast service, not too much wait, and usually there is always a space to sit.",4 stars
Not a bad McDonald's but you have to tell him fresh you ordered fresh food,3 stars
"Slow!!!!  Haven't tried the food yet, since I am min minute 32 of waiting for my FAST food",2 stars
Very clean and friendly staff. My family and i had a great time.,5 stars
Very busy but food came out good . Lobby was packed,4 stars
I love it I am at this location and I buy my food there every day,5 stars
"Clean restaurant, lobby is open but drink area is not.",5 stars
"Quick service, nice people but messed up my order a little.",4 stars
Quick service even though kiosk were down. Attention to detail a plus!,5 stars
On Christmas day with an upbeat attitude. Fast and organized with a smile fully staffed. Impressive,5 stars
"Place is dirty I don't recommend no one to stop at this place the drinking fountain is dirty, workers have a attitude drive thru takes least 25 min to a car to move!",1 star
Rushed us while ordering and mess up our Order twice while in the area for vacation.,3 stars
"Sooo slow, and got my order completely wrong. Didn't seem to care.",2 stars
COFFEE -Great Coffee,5 stars
The people at the window were rude and they were out of everything! And waited in line for 30 min and then was told that they were cash only!!!!,1 star
Nice  service  but  i  see  a  super viser  was  talking   bad  to  cow  worker  dint  like  the  way  she  was  talking  she  at  like  a  man,5 stars
"It's automated now it's quick it's easy.  The all day breakfast is available too,  how can you beat that?",4 stars
Its mickey Ds.  very average.  at least the drive thru line was fast.,3 stars
Loved it,5 stars
The food was hot I'm just not a fan of McDonald's but two children enjoyed it,2 stars
Good food not to crowded. Yes it's really a mc donalds,3 stars
Closed early and drive thru takes forever,2 stars
Need to update breakfast app menu and add back the souther style chicken biscuit,2 stars
Terrible I ordered my food at 8:40 AM it is currently 9:01 and my food is still not here,1 star
"took 30 minutes for our food to come out, walked past us once, forgot the sauces and forgot the drinks along with a very negative attitude",1 star
Great place for kids in old town,5 stars
fast service and nice staff,5 stars
"Fast service, Food was hot and fresh",5 stars
I thought there was going to be a long wait but  we got our food in less than 10 minutes,5 stars
Other than the usual. When comparing and three restaurants in Apopka this one has to have the best sweet tea,5 stars
It smell and it was dirty. The worker were very pleasant,2 stars
Food is nasty and wait at night is unheard of. Horrible staff,1 star
My favorite McD's in Kissimmee. The food is always fresh and hot and the service is always friendly.,5 stars
"Good service, got my order right the first time!",4 stars
They forgot the top bun on one sandwich. Everything else wasn't much better. Thrown together and awful.,2 stars
Quick service even when there is a line in drive through,5 stars
A nice place to eat. They have new technology to order your food from a screen.,5 stars
"Was enjoy my birthday breakfast  until i bit down into egg shells ,  great way to ruin a meal and a sandwich",3 stars
Clean tidy good staff and free refills on all drinks. Should be like this in UK.,5 stars
Nuggets were disappointing compared to the UK!,3 stars
The service here was fast,5 stars
"Clean, friendly, quick. More breakfast pastries than we are used to.",4 stars
"Took too long to complete order, dirty floor, overall impression of a badly run McDonalds - a rarity.",2 stars
Worst McDonald's I've been to,1 star
Omg glow tables!,5 stars
Not enough help. Food wasn't fresh,3 stars
Great quick fix delicious foods and great service super yummy,5 stars
"Service slow, food cold and dry. Had to queue back up to get a cup.",2 stars
I tried to buy a burger for a homeless lady and the manager told me no! She then approached the homeless lady and told her to leave.,2 stars
A little slow the service.. Had to do the  order myself at the kiosk,4 stars
Great hot food and cold drinks.,4 stars
This location has closed seating and has take out only.,3 stars
Food Was Excellent and So Was The Beverage,5 stars
"Was just like McDonald's really. Large portions are huge, fries oversalted and coke tasted weird.",4 stars
"USA Maccys just as good as the UK, but the m&ms Mcflurries are so much better!",5 stars
Cleanest one i have seen.,5 stars
Why 14 minutes for 2 Apple pies? Order wss placed 2-3 minutes before that.,1 star
"Forgets food often, longer wait time than some coasters in town. Ran out of diet coke.",2 stars
"They have a nice offer, a break fast sampler for 5 dollars!",4 stars
I visited this store many time during my stay in Orlando. Great service every time.,5 stars
Look McDonald's gets alot of grief but let's face it. Good quick food.,5 stars
Newly remodeled. Self ordering kiosks so 1 less person to screw up the order.,4 stars
Responsive service and organized systems. Even late at night. Good in my books.,5 stars
Food was the same but this was a half hour wait for food. Clearly this franchise was not up for a noon rush hour.,2 stars
Very slow service and tables weren't wiped down or cleaned.,3 stars
"Clean, nice staff, get custom orders right.",5 stars
"We went few times at this restaurant and it is the worst service we received . Very slow, and leasy.",3 stars
Typical McDonald's,3 stars
Recieved my food quick and was satified with how fresh it was.,4 stars
Drive thru experience. Staff was very friendly. Food was cold when it was delivered. Fries were very salty.,3 stars
The food tastes like microwaved meat with barley any flavor,1 star
"Staff is friendly.  For me, burger wasn't hot just warm.",3 stars
Love the playground for children!!! My son had a lot of fun.,5 stars
Just stopped in for an early bite to eat,4 stars
Took the grandchildren there they loved it a little slow though,4 stars
"The breakfast was GREAT. Their pancakes, superb.",4 stars
Great customer service  cashier Laquisha has great customer support experience,5 stars
Wait for almost an hour for the order. The delivery lady missed our table and send our food to another table. Worst M store ever,1 star
Good service  and food is ok,4 stars
They were extremely slow.,2 stars
They were very very busy but boy they had all the food right,4 stars
"Great place for a quick meal with the family, on the go or both!",5 stars
Typical Mcdonalds,4 stars
Service was fast and good,4 stars
They didn't make sure my order was complete. I found that out when I arrive to my hotel room.,4 stars
My food was hot and fresh and the restaurant was clean.,5 stars
Great but can be very busy in the drive through.,5 stars
Love that you can pay in an automatic machine. We need that here like ya!,5 stars
Forgot our food twice. Went back and they act like we were lying about it,1 star
We ordered at the online till in the restaurant and had a lovely meal.,4 stars
"McDs always great with menu, value, updates, but has trouble getting orders right. SO ALWAYS CHECK BEFORE LEAVING",4 stars
Very nice place..... Very large play area for the children and clean atmosphere,4 stars
Customer service could be better. But it's ok in general,3 stars
"Not professional when speaking to customers, but take what you can.",3 stars
Food was fresh and service was fast!!,5 stars
Service very slow on all 3 visits and they get the order wrong.  Very very poor.,1 star
Ok place to come by with family too eat clean bathroom,3 stars
"Very clean, friendly staff.  Enjoyed my food.",5 stars
"Staff was nice, usually always see someone cleaning, at times it can be overcrowded.",4 stars
"Terrible restaurant, very dirty, I do not understand how Mac DOnal let have this disgusting restaurant",1 star
Very good food. Just lines are to long,4 stars
The service in every Mcdonalds is doing worst with the time.,2 stars
Kid loves the playground. Food is McDonalds what else. Clean place,4 stars
Great place just frappe they serve to the top and it spills every single time,5 stars
Ordered a 6 piece chicken nugget kids meal and was given a filet o fish in the box instead,3 stars
Good and fast,5 stars
"Lately they have been super fast.
Very clean.",5 stars
Always on point with orders and great customer service,5 stars
always making mistakes and errors with orders or don't have the employees to service customers,1 star
It's McDonald's atleast they are open Laure for driive through,3 stars
Great place for a quick bite,5 stars
Dirty place very unclean and big wait for cold food!,1 star
Ashes for a cheese burger with no pickle or onion and even had ths sticker on the box. Still had pickle and onion on it,3 stars
Service was fast order was correct.,5 stars
Fries were cold and they did not like the fact I asked for fresh ones.,1 star
It's not a bad McDonald's those young kids try their best,3 stars
Food was good and quick.,5 stars
Busy as heck but still gets my order right but in need of more ppl,5 stars
"Ate 340 chicken McNuggets with a bunch of friends one night, it was awesome!",5 stars
"The manager was really mean with the employee...if them have a problem with the employee ,they must take them to the back",1 star
"Service was lovely, very helpful explaining items.",5 stars
Worst place ever very bad customer service...if i could put - stars i would.,1 star
Would get more stars if they got my order right more than 3 out of five times,3 stars
"Food lovely, slow service for fast food.",3 stars
Have a playpark for the kids to burn off some energy while enjoying food.,5 stars
This place was great nice people fresh food,5 stars
Order food here and wait 30 mins for your order.... no fast food here,1 star
Always a good quick option,5 stars
Super easy the self order station. Cosy place,5 stars
This mcds was fast for real. And that impressed both me & my friend.,5 stars
"Bad service ... I'm very disappointed, this place has awful customer service .",1 star
3 times asked for sauce for nuggets got home no sauce,1 star
"The rains made a mess of the drive thru.
20 minutes was ridiculous",3 stars
When you are starving and nothing else in sight for the pocket change you have..... well that's why i go to McDonalds.,2 stars
The place is nice and clean. Crew there is very friendly.,5 stars
What's the point of opening untill 4am and having 4 items on your menu!!,4 stars
"Friendly staff, fresh food clean atmosphere",5 stars
"Good food, very busy drive thru",4 stars
"Only one cashier, the place was super busy waited 28 Minutes for my food it was cold, worst McDonald's experience ever!",3 stars
Great customet service and extremely polite and friendly.,5 stars
A great place to grab you something to eat on the run .,5 stars
No cashiers.  Incomplete order.,4 stars
Fast and ok food... Was a little cold.,4 stars
"Hot food and quick service.  Playground with too many kids, make it too noisy.",4 stars
"I've been going to this location most of my life since it's not far from my home. So I've seen this McDonald's go through a lot of changes. The employees here generally have decent attitudes, there are a few that tend to be rude. The store is also dirty a lot of the time. It's a very busy location, and maybe it's from having a lot of foot traffic, but the floor is usually dirty, the drink station will be filthy and wet and sticky, the ketchup area will be out of ketchup, and/or there will be ketchup all over the place, too. The tables tend to be dirty, too, you usually have to clean off your own table. Also they have those light up tables that kids like, and when I go in there with my kid there will be homeless people sitting there, and they won't be eating, and they'll have their stuff all over the place and sit there for hours. And mind you, these tables seat about 8 and there will be one homeless person sitting there. My kid will want to sit there so he can play with the lights, and I'll have to tell him he can't because this one homeless person sitting at one of the largest table, is camping there. The employees don't seem to care at all that these people are doing this despite them sitting there for hours, but buying anything. Sometimes they'll even be sleeping at the table.
The kid's play area is also really crappy. They have nothing for the kids to play on like a playplace. They have 4 of these really crappy touch screen games things that rarely work properly, or at all. When I was a kid they had a huge playplace, which they took out when they remodeled the store. It even had N64's at one point, along with the playplace. But they took it all out and replaced it with a ""sitting"" place instead of a playplace. It's really awful.
So, all in all, this McDonald's is dirty, has a lot of homeless people that practically live there, and isn't really kid friendly. The food is okay, as long as it's hot food (I get a lot of cold food or my order is wrong), and the employees are generally friendly, but there have been a lot of times where the managers are rather lackluster, meaning that you can tell they don't want to be there. This location needs a lot of work. And they need to do something about the amount of homeless people that hang around in there. There hasn't been a single time I've gone there that there wasn't at least one homeless person there taking up the interactive table that kids want to sit at, with all their dirty things sitting on the table itself. The table is by the front counter, too and you can often times smell the homeless person that's sitting there the whole time you're waiting in line and waiting for your food and while you get your drinks. It is not kid friendly at all at this store. With the store being in a nicer part of town you'd expect quite a bit more cleanliness.",2 stars
"This location was awful today. They rang up our order wrong, then gave it to us still wrong. Took over 15 min to get our order and we had to ask for our drink cups so we could at least get our drinks while waiting. As we stood there, we saw almost every person have a problem with their orders. The person at the register was messing up every order and the back kept making the wrong things. Worst visit ever.",1 star
"Horrible service. Drive thru speaker was not lit up/broken and when I pulled up to order, I was greeted rudely. I asked if I could order at the window and the lady said ""i guess so."" My order was also wrong and the bacon burger came with no bacon. BAD place to visit during a 3rd shift!!",1 star
The food at this store is always done right. They seem to run a good kitchen. Things are served at the right temp and 99% of the time taste great. Unlike other stores where you've got about a 60% chance of great food.,5 stars
Worst McDonaldï¿½ï¿½ï¿½ï¿½ï¿½ï¿½ï¿½ï¿½,1 star
"There always seems to be a rush and not in a good way. Obvious rush hours are meant to be hectic. But when most of the staff are young and  teenage-ish  and rightfully so because age and mindset it a bit understandable.  But not getting right items with orders, or taking longer the should be to get final order is saying something. Having work in the Food & Beverage industry for numerous years in various positions  I Sympathize. When an Iced flavored coffee is made so sweet  with Syrup it's undrinkable that's not acceptable nor is  Appreciated.",3 stars
"It's McDonald's not much to say.
Service was pretty fast.",4 stars
"No matter the time of day, this location always messes up my order, shorts me or makes me wait wayyyy toooo long.  Will not be going back to this location as I have given them way too many chances and for years nothing has change other then worse service.",1 star
"Two employees preparing the food simply didn't wear a mask. I am highly dissatisfied with the effort put into enforcing the wearing of a mask. Why during this pandemic, which has not settled in the least, have you not have had a keen eye on employees in order to safeguard the wellbeing of your customers. It's unacceptable to have this lack of care while thousands of healthcare workers are having to work day in and out (With a mask on!) To save lives. Consider this message before you enter this McDonald's (Or any restaurant really) because the meal you get can very well be the deciding factor on whether or not you live in weeks time.
And the fries were luke warm..",1 star
"Ordered 2 fillet o fish sandwiches after not having McDonald's for  months, ordered Xtra cheese got extra tarter instead. Had it remade got no tarter no extra cheese again. This is why ppl  are mad you make such a high wage. :(",2 stars
The food was at McDonald's standards. But the upkeep of the restaurant was less than average. Garbage cans overflowing. Foot prints all over the floor and the fountain drink dispenser wasn't draining. Its had about an inch of fluid in the waste catcher. You couldn't even set your cups down to fill them up.,2 stars
